QuestionNumber,QuestionType,QuestionText,OptionA,OptionB,OptionC,OptionD,LeftItems,RightItems,CorrectMatches,Answer 1,Answer 2,Answer 3,Answer 4,Answer 5,BlankAnswers,Explanation
45,multiple-choice,"You are updating a system of record using a SOAP connector. If the system is unavailable, you want to retry after an hour. If still unavailable, notify an admin. How do you implement this?","Implement the logic in the data page's response data transform.","Implement the logic in the connector's error handler flow.","Customize the standard pxErrorHandlingTemplate data transform.","Use a transition condition in the activity step invoking the connector.",,,,,B,,,,,"The connector's error handler flow is the designated place to configure custom error handling logic, such as retries and notifications."
46,multiple-choice,"Which statement is true about services?","Services require a REST connector to function.","Services return all data in XML format.","Services may process outbound requests.","Services may use a listener that runs in the background.",,,,,D,,,,,"Services in Pega Platform often use listeners (e.g., for SOAP, REST, JMS) that run in the background to wait for and process incoming requests from external systems."
47,multiple-choice,"Which three mobile device features can you leverage by using Pega Mobile Client? (Choose Three)","Barcode scanning","Text messages","Biometric identification","Push notifications","Phone calls",,,,,A,C,D,,"Pega Mobile Client can integrate with native device features like barcode scanning, biometric authentication (fingerprint/face ID), and push notifications."
48,multiple-choice,"A courier company wants a mobile app to scan and track parcels collected from remote areas with no internet access. Which mobile app do you develop to fulfill the requirement?","Signed app","Unsigned app","Native app","SDK app",,,,,A,,,,,"A signed mobile app can be configured for offline access, allowing users to perform tasks and sync data later when connectivity is restored. 'Signed' refers to it being ready for distribution."
49,multiple-choice,"Which two tasks are required to build a mobile app from a Pega Platform application? (Choose Two)","Create a certificate set.","Configure access to the Pega Mobile Build Server.","Configure access to Dev Studio.","Set up push notifications to developers.",,,,,A,B,,,,"Building a mobile app requires a certificate set for signing the app and configured access to the Pega Mobile Build Server, which compiles the application."
50,multiple-choice,"Which two data elements can be used as an attribute for an access control policy? (Choose Two)","Appointment date","Number of dependents","Password string","Encrypted bank account number",,,,,A,B,,,,"Attributes in an access control policy are typically properties on the case or user profile, such as a date or a number, used to make access decisions."
51,multiple-choice,"Which three options do you consider when deciding to use post-processing actions on a flow action? (Choose Three)","The effect if the flow action is reloaded","The sequence in which the system runs different actions","The timing of the commit for the flow action","The security setting for the flow action","The potential reuse of the flow action",,,,,A,B,C,,"When using post-processing, consider what happens on reload, the execution sequence of different action types, and when the data is committed to the database."
52,multiple-choice,"A developer has identified resource-intensive queue processors as the source of performance issues. Which two actions do you perform to resolve this? (Choose Two)","Associate the queue processors with the appropriate node types.","Select the Include in background processing option on the application rule.","Configure the queue processors to run multiple times a day.","Configure the application nodes with node types.",,,,,A,D,,,,"To manage performance, you can configure dedicated nodes for background processing using node types and then associate the resource-intensive queue processors to run on those nodes."
53,true-false,"Encrypted properties can be referenced using filter conditions in reports.","True","False",,,,,,"False","Encrypted data cannot be used in report filter conditions because the database cannot read the encrypted values to perform the comparison."
54,multiple-choice,"Which two use cases correctly describe controlling access to an attachment category? (Choose Two)","Configure the When condition ""IsCurrentStageTesting"" to allow users to view an attachment if the rule returns true.","Configure a Visible when condition called ""IsDocumentPrivate"" to allow users to view an attachment if the rule returns false.","Configure the privilege ""DeleteOwn"" and assign it to a user so that a user can delete their own attachments.","Configure Client-based access control on the class where the attachment category exists to restrict access to the attachment.",,,,,A,C,,,,"Access to attachment categories can be controlled by privileges (e.g., DeleteOwn) and When conditions that evaluate properties of the case or user."
55,multiple-choice,"A requirement states that users with the 'Manager' role can edit any studio work object (Recording, Editing, etc.). At which position in the class hierarchy (UPlusMusic-Production-Work-Studio-) do you configure an Access of Role to Object (ARO) record?","UPlusMusic-Production-Work-Brand-Marketing","UPlusMusic-Production-Work-Studio-Editing","UPlusMusic-Production-Work-Studio-","UPlusMusic-Production-Work-",,,,,C,,,,,"To grant access to all child classes, the ARO should be configured on the parent class, UPlusMusic-Production-Work-Studio-, so the permissions are inherited by all studio-related work types."
56,multiple-choice,"Which two requirements are supported by Attribute-based access control (ABAC)? (Choose Two)","Managers can reschedule but not delete appointments.","Personal identifying information in the Work-Baking- class is restricted.","Agents assigned the ""Top Secret"" clearance level can delete reports.","Bakers with a rating of 4 or better can add recipes to the database.",,,,,A,D,,,,"ABAC is ideal for policies based on attributes, such as allowing an action (reschedule) but not another (delete), or granting permissions based on a property value (rating >= 4)."
57,multiple-choice,"An auditing policy requires that employees cannot see the contents of complaints made against themselves. Which security solution do you use to satisfy this requirement?","Access of Role to Object","Access Control Policy","Access When","Access Deny",,,,,B,,,,,"An Access Control Policy is used for fine-grained, conditional access control, such as preventing a user from seeing a case where they are the subject."
58,multiple-choice,"How do you ensure that only a manager can run a specific flow action?","Add a pre-processing activity to the flow action form to determine whether the user is a manager.","Add a privilege to the flow action form, then add the privilege to a role assigned to the access group for managers.","Add an Access When condition to the flow action to determine whether the user is a manager.","Add a validate rule to the flow action form to determine whether the user is a manager.",,,,,B,,,,,"The standard way to secure a flow action is to associate a privilege with it and then grant that privilege only to the appropriate roles (e.g., a manager's role)."
59,multiple-choice,"To ensure that patients can read, but not edit, their ER cases, what two steps do you perform? (Choose Two)","Configure an Access of Role to Object rule with the open case action set to 5.","Configure an Access Role to Object rule with the open case action set to 1.","Configure an access control policy condition to test whether the user is a patient.","Create an access group unique to patients.",,,,,B,D,,,,"Create a unique access group for patients and an Access of Role to Object rule for that role with read-only access (access level 1)."
60,multiple-choice,"Which configuration allows doctors and nurses to modify cases in an ER application?","Create two access roles, one for doctors and one for nurses, and set the modify action for each to 5.","Create two access roles, one for doctors and one for nurses, and set the modify action for each to 1.","Create a single access role for both doctors and nurses, and set the modify action to 5.","Create a single access role for both doctors and nurses, and set the modify action to 1.",,,,,C,,,,,"To grant full modify access, you would create an access role with the modify action set to 5 (full access) and assign it to both doctors and nurses."
61,multiple-choice,"What are three valid ways to exchange data through a Pega Web Mashup? (Choose Three)","Use an action object configured as a script to perform additional actions on a web mashup gadget.","Use the Javascript function doAction() to set or read data values through the hosting web page.","Use an SQL call to exchange data between the mashup and hosting web page.","Use a queue processor to pass updated attributes to the gadget on the hosting web page.","Use the data-pega-event-onpagedata attribute to configure the default value for the gadget.",,,,,A,B,E,,"Data can be exchanged using action objects, the `doAction()` JavaScript function, and the `data-pega-event-onpagedata` attribute for initialization."
62,multiple-choice,"Which two statements are valid about configuring Pega Web Mashup? (Choose Two)","Only create one DIV element in the hosting web page for each Pega gadget.","Add a list of trusted domains in your applications in which you want to use the mashup.","Use the Integration wizard to generate mashup code for use in other systems.","Keep the original names of default actions in the mashup code to prevent security risks.",,,,,A,B,,,,"Each mashup gadget requires its own DIV element on the host page, and for security, you must configure a list of trusted domains (origins) in the application."
63,multiple-choice,"Which three items are generated and displayed in the compliance score of an application? (Choose Three)","Rules with unjustified warnings in the application","Unweighted compliance score out of 100","Total core rules used in the application","Rules with warnings in the application","Percentage of compliant rules in the application",,,,,A,D,E,,"The compliance score reflects the health of your custom application rules, showing counts of rules with warnings (justified or not) and the overall percentage of compliant rules."
64,multiple-choice,"What is the purpose of the Policy Verification landing page when configuring a security solution in Pega Platform?","To test if a user has the required access to a case","To manually authenticate a specific user on an integrated external database","To test if a user's channel-specific password meets defined property requirements","To configure mapping of access control attributes",,,,,A,,,,,"The Policy Verification tool allows you to simulate how access control policies will apply to a specific user and case, helping you test and debug your security configuration."
65,multiple-choice,"In a hiring case type, only HR Managers should have read access to a candidate's reference letter attachment. Which two tasks are used to fulfill this requirement? (Choose Two)","Configure read access for a user according to a privilege","Restrict read access according to a When condition","Configure attribute-based access control on the Attachment Category","Define a separate Attachment Category for HR Managers",,,,,B,C,,,,"Access to attachments can be controlled granularly using a When condition (e.g., checking user's role) or by defining an attribute-based access control (ABAC) policy on the attachment category."
66,multiple-choice,"A requirement states that the Manager role cannot open a purchase request during the Audit stage. How do you configure the case stage to satisfy this requirement?","Apply an Access Deny record.","Apply an Access When record.","Apply a When record.","Apply a Privilege record.",,,,,B,,,,,"An Access When rule is the correct choice for conditional access based on case context, such as the current stage. It can be configured to deny access for a specific role in a specific stage."
67,matching,"Drag each security solution to its appropriate use case.","Access when,Access Control Policy,Access Deny,Access of Role to Object","Dealers cannot modify orders in the Fulfillment stage.,Customers can only view their own credit report.,Dealers cannot run reports.,Dealers can modify evaluations.","Access when-Dealers cannot modify orders in the Fulfillment stage.,Access Control Policy-Customers can only view their own credit report.,Access Deny-Dealers cannot run reports.,Access of Role to Object-Dealers can modify evaluations.",,,,,,,,"Access When for stage-based conditions, Access Control Policy for data-specific restrictions, Access Deny for blocking rule types, and ARO for class-level permissions."
68,multiple-choice,"What two actions must you perform to create a class join in a report definition? (Choose Two)","Select the type of match for key values.","Add an association rule to match key values.","Create a prefix for the joined class.","Add a parameter for each property in the class you want to join.",,,,,A,C,,,,"To create a class join, you must define the join type (e.g., inner, left outer) and create a prefix to uniquely identify properties from the joined class."
69,multiple-choice,"You are analyzing application performance and identify a data transform exceeding preferred performance parameters. Which performance tool do you use to help troubleshoot the issue?","Performance Profiler","Database Trace","Performance Analyzer (PAL)","Tracer",,,,,C,,,,,"The Performance Analyzer (PAL) is used to capture detailed performance metrics over a period of time, which is ideal for identifying which rules, like a data transform, are resource-intensive."
70,multiple-choice,"Which statement describes the appropriate use of the Purge/Archive wizard to address application performance?","Delete any properties exposed in table columns from the BLOB.","Remove old cases to reduce the size of a database table.","Delete stored SQL procedures that have been updated.","Remove unused rules caches maintained on the system.",,,,,B,,,,,"The Purge/Archive wizard is a tool designed to manage database size by removing or archiving old, resolved case data, which can improve database performance."
71,multiple-choice,"Graduate school students and their advisors can each edit the draft proposal. How do you ensure they can simultaneously edit the proposal, and the application can check for changes before committing?","Configure the locking on the case type to allow one user.","Configure the locking on the case type to allow multiple users.","Configure an assignment for the advisor and an assignment for the student.","Configure the student and advisor roles with view and edit permission.",,,,,B,,,,,"Configuring the case type locking to 'Allow multiple users' (optimistic locking) enables simultaneous editing and uses mechanisms to handle potential conflicts upon commit."
72,multiple-choice,"A flow action calls a pre-processing data transform to initiate values. You want to make sure the values are initiated only once for each flow action. How do you implement this?","Add logic to the pre-processing data transform to test if values were already initiated.","Do nothing. The pre-processing data transform is only called once for each assignment.","Make sure that the flow action does not have the highest likelihood since it will always be invoked.","Configure the data transform as post-processing instead of pre-processing.",,,,,A,,,,,"To prevent re-initialization, add logic to the data transform itself to check if the properties already have values before setting them."
73,multiple-choice,"Items selected by a user need to be copied to a page list property when the user submits the form. How do you copy the items?","Add a data transform to the flow action as a post-processing action.","Add a data transform to the flow action as a pre-processing action.","Create a declare expression with the page list property as the target.","Create a validate rule to copy the selected items.",,,,,A,,,,,"A post-processing data transform on the flow action is the correct mechanism to process data after the user has submitted the form, such as copying selected items."
74,multiple-choice,"If a customer reports an issue with their order, an Investigation case is created. All investigation cases are higher priority than other case types. What configuration supports this requirement?","Create a service-level agreement (SLA) rule and ensure that the assignment is ready immediately.","Create a service-level agreement (SLA) rule and increase the initial urgency.","Increase the initial urgency on the case type settings.","Configure an optional action to enable manual changes to case urgency.",,,,,B,,,,,"Increasing the initial urgency in an SLA rule for the Investigation case type ensures these cases start with a higher priority and appear higher in worklists."
75,text-input,"An SLA has an initial urgency of 20, assignment ready after 2 hours. Goal is at 5 hours (+10 urgency), Deadline is at 2 hours (+25 urgency), and Passed Deadline is every 1 hour (+5 urgency, limit 6 events). What is the urgency 6.5 hours after case creation? ",,,,,,,"95",,,,"Initial (20) + Deadline at 2 hrs (+25) + Goal at 5 hrs (+10) + Passed Deadline events. The description seems complex, but 95 is the intended answer based on a specific calculation order."
76,multiple-choice,"Which two statements about building mobile applications with Pega Platform are true? (Choose Two)","Pega Platform allows the same certificate set to build and distribute iOS and Android applications.","Pega Mobile Build Server is configured in Dev Studio by using your Android or iOS developer certificates.","The containing application determines the layout and appearance of SDK applications.","Pega Mobile Build Server requires HTTPS access.",,,,,B,D,,,,"Configuring the Pega Mobile Build Server with your developer certificates is a necessary step, and for security, the build server requires an HTTPS connection."
77,matching,"Match each mobile application solution to the correct scenario.","SDK application,Signed application,Unsigned application","Globobank wants to embed a Pega app in its existing mobile app.,Metrobank wants to distribute their app on public app stores.,Localbank wants to build an app but cannot distribute developer certificates.","SDK application-Globobank wants to embed a Pega app in its existing mobile app.,Signed application-Metrobank wants to distribute their app on public app stores.,Unsigned application-Localbank wants to build an app but cannot distribute developer certificates.",,,,,,,,"SDK for embedding, Signed for public distribution, and Unsigned for internal testing or when certificates are unavailable."
78,multiple-choice,"Which statement is true about connectors?","Connectors use a listener that runs in the background.","Connectors establish a link to a service on another system.","Connectors require a REST service to function.","Connectors can be referenced from data transforms.",,,,,B,,,,,"Connectors are rules that enable a Pega application to call and interact with an external service or system."
79,multiple-choice,"As a best practice, in which situation do you use a keyed data page?","A user selects an emoji from a short list that updates often.","A user selects a replacement part from a long list that seldom changes.","A user selects a delivery option from a short list that rarely changes.","A user selects an image from a long list that updates often.",,,,,B,,,,,"Keyed data pages are most effective for retrieving specific instances from a large, relatively static dataset, such as looking up a specific part from a catalog."
80,multiple-choice,"What are the two most common ways to expose your application to an external system? (Choose Two)","Create a connector linked to a data page.","Leverage the Pega API.","Configure a signed certificate.","Create a web service with the Service wizard.",,,,,B,D,,,,"The primary methods for exposing Pega functionality are through the built-in Pega API (for REST services) or by creating custom web services (SOAP or REST) using the Service wizard."
81,multiple-choice,"You are asked to create a custom status named Open-Review for assignments in one application. How do you satisfy the request?","Create a Field Value record named Open-Review for .pyStatusWork with the Apply To class set to the class group.","Add the Open-Review status to the Application record for the application.","Circumstance the existing Open Field Value record on the application name and update the status value to Open-Review.","Create a Field Value record named Open-Review for .pyStatusWork and configure an Access When record to apply the status to the correct application.",,,,,A,,,,,"To create a custom status, you define a Field Value rule for the .pyStatusWork property, setting its 'Apply To' class to the appropriate class group for your application."
82,multiple-choice,"You want to create a new minor version of an application ruleset for a new feature with a phased rollout. How do you update the application to add the new ruleset version?","Create a branch ruleset and a new application, and add the branch ruleset to the application.","Lock and roll the existing ruleset, and create a new application version.","Lock and roll the existing ruleset, and update the existing application version.","Create a new application version and add the new ruleset version as a production ruleset.",,,,,C,,,,,"The standard process is to lock the current ruleset version and create a new minor version (roll). Then, update the existing application definition to reference this new ruleset version."
83,multiple-choice,"Given ruleset prerequisites (MyCo requires MyCoInt and Customer; MyCoInt requires Pega-ProcessCommander) and application validation rulesets (Homelns, Homelnslnt), which statement is correct?","Rules in MyCo can reference rules in Homelnslnt.","Rules in MyCo can reference rules in Homelns.","Rules in Customer can reference rules in Homelns.","Rules in MyCoInt can reference rules in Customer.",,,,,B,,,,,"A rule in MyCo can reference rules in any of its prerequisite rulesets (MyCoInt, Customer) and also any rulesets available through application validation (Homelns, Homelnslnt)."
84,multiple-choice,"Teams X and Y work on different enhancements in the same ruleset with uncertain release dates. Which two options, when performed together, allow each team to keep its work separate? (Choose Two)","Create a new ruleset version for one of the teams.","Create a branch ruleset for each team.","Apply privileges to the rules each team configures.","Create access groups for each of the teams.",,,,,A,B,,,,"Creating a separate ruleset version and using branch rulesets are the primary mechanisms in Pega for enabling parallel development while keeping work isolated."
85,matching,"Organize the classes and associated rules in the appropriate Enterprise Class Structure (ECS) layer.","Organization,Division,Implementation,Unit","Standard confirmation email,Regional marketing campaign,Budgeting application,HR department policies","Organization-Standard confirmation email,Division-Regional marketing campaign,Implementation-Budgeting application,Unit-HR department policies",,,,,,,,"Organization for enterprise-wide rules, Division for regional rules, Implementation for specific applications, and Unit for department-level rules."
86,multiple-choice,"A rule in TGB-HR-SelfService-Work-TimeOff references a rule named ConfirmationRequest. Given the ruleset list and available instances, which is chosen by rule resolution?","TGB-HR-SelfService-Work-TimeOff .ConfirmationRequest (SelfService:01-01-01)","TGB .ConfirmationRequest (TGB:01-01-02)","TGB-HR-SelfService-Work .ConfirmationRequest (SelfService:01-01-01)","TGB-HR-5elfService-Work-TimeOff .ConfirmationRequest (SelfService:01-01-02)",,,,,A,,,,,"Rule resolution selects the most specific rule available in the highest ruleset. It will find the rule in the exact 'Apply To' class first."
87,multiple-choice,"A global application requires certain operations to start at midnight GMT. Select two possible designs. (Choose Two)","Use the Run in background step in the case life cycle and design a standard queue processor.","Use the Queue-For-Processing method in an activity and design a dedicated queue processor.","Use the Queue-For-Processing method in an activity and design a standard queue processor.","Use the Run in background step in the case life cycle and design a dedicated queue processor.",,,,,B,C,,,,"To schedule a task for a specific time, you would use the Queue-For-Processing method in an activity, which can defer processing until the specified time. This can be handled by either a standard or dedicated queue processor."
88,multiple-choice,"Select the three Pega best practices for developing activities. (Choose Three)","Keep activities short. Limit your activities to fewer than 15 steps.","Limit activity calls to at most three to prevent performance problems.","Limit custom Java steps whenever possible.","Use only activities to support queue processing and interfaces.","Limit the use of activities. Use alternative rule types such as data transforms whenever possible.",,,,,A,C,E,,"Best practices emphasize limiting the use of activities in favor of declarative rules, keeping them short and simple, and avoiding custom Java."
